{
  "kind": "installation-profile",
  "schemaVersion": 1,
  "profileId": "toy-test-rig",
  "label": "Toy heist \u2014 test rig",
  "version": 1,
  "forPack": "midnight-heist",
  "orchestrator": true,
  "bindings": {
    "lighting": {
      "vault-alarm": {
        "ha": "scene.witness_vault_alarm"
      },
      "all-clear": {
        "ha": "scene.witness_all_clear"
      }
    }
  }
}
